Name,Description,Latitude,Longitude,InfoURL,ImageURL
UCSB,"This is the university that I am currently attending, as well as my second home.",34.416929,-119.845991,"https://en.wikipedia.org/wiki/University_of_California,_Santa_Barbara ",https://i0.wp.com/dailynexus.com/wp-content/uploads/2018/03/Facts-UCSB-Campus-by-Olivia-Consterdine-PRINT-2-2.jpg?fit=1003%2C1212
The Flumes,"A stunning hiking area in Paradise, CA. I've visited this location with some of my closest friends during the summer of 2018.",39.785501,-121.56366,http://activenorcal.net/outdoors/the-flumes-and-cable-pools-of-paradise/ ,https://theorion.com/wp-content/uploads/2018/04/Flumes-874x900.jpg 
Arbuckle,This has been my hometown for the majority of my life. There's no place like home!,39.013264,-122.064312,"https://en.wikipedia.org/wiki/Arbuckle,_California ",https://i.ytimg.com/vi/zXQcV2VO6Qw/maxresdefault.jpg 
Santa Cruz Board Walk,A beach boardwalk with food and games. I visited this location with friends.,36.975567,-122.033059,https://en.wikipedia.org/wiki/Santa_Cruz_Beach_Boardwalk ,https://dnnmyvak1.blob.core.windows.net/portals/0/Images/photo_BeachShot01.jpg?sr=b&si=DNNFileManagerPolicy&sig=PuLrlmyH3NuQhWGdlquwt%2B31SndiHNshTuWXBylMYDQ%3D 
Universal Studios Hollywood,I have wanted to visit this amusement park to check out the Wizarding World of Harry Potter.,34.138161,-118.353378,https://en.wikipedia.org/wiki/Universal_Studios_Hollywood ,https://i0.wp.com/thepointsguy.com/wp-content/uploads/2018/08/UniversalStudiosReview__33.jpg?fit=1280%2C960px&ssl=1 
Disney California Adventure ,"A lovely amusement park located in Anaheim, CA where I've made wonderful memories with friends during High School.",33.805927,-117.921458,https://en.wikipedia.org/wiki/Disney_California_Adventure ,https://www.latimes.com/resizer/1fFpHs5BNv708kaY-MoQgvK0ybY=/800x0/www.trbimg.com/img-59fb8998/turbine/la-1509656978-igal81qicr-snap-image 